<?xml version="1.0" encoding="UTF-8" ?>

<config xmlns="http://thelia.net/schema/dic/config"
        xmlns:xsi="http://www.w3.org/2001/XMLSchema-instance"
        xsi:schemaLocation="http://thelia.net/schema/dic/config http://thelia.net/schema/dic/config/thelia-1.0.xsd">

    <export_categories>
        <export_category id="thelia.export.customer">
            <title locale="en_US">Customers</title>
            <title locale="fr_FR">Clients</title>
        </export_category>
        <export_category id="thelia.export.products">
            <title locale="en_US">Products</title>
            <title locale="fr_FR">Produits</title>
        </export_category>
        <export_category id="thelia.export.content">
            <title locale="en_US">Content</title>
            <title locale="fr_FR">Contenu</title>
        </export_category>
        <export_category id="thelia.export.orders">
            <title locale="en_US">Orders</title>
            <title locale="fr_FR">Commandes</title>
        </export_category>
        <export_category id="thelia.export.modules">
            <title locale="en_US">Modules</title>
            <title locale="fr_FR">Modules</title>
        </export_category>
        <export_category id="thelia.export.reports">
            <title locale="en_US">Reports</title>
            <title locale="fr_FR">Rapports</title>
        </export_category>
    </export_categories>

    <exports>
        <export id="thelia.export.mailing" category_id="thelia.export.customer" class="Thelia\Domain\DataTransfer\Export\Type\MailingExport">
            <export_descriptive locale="fr_FR">
                <title>Mailing</title>
                <description>Exporter le nom, prénom et adresse mail des abonnés à la newsletter</description>
            </export_descriptive>
            <export_descriptive locale="en_US">
                <title>Mailing</title>
                <description>Export the last name, first name and email address of the newsletter subscribers</description>
            </export_descriptive>
        </export>

        <export id="thelia.export.complete" category_id="thelia.export.customer" class="Thelia\Domain\DataTransfer\Export\Type\CustomerExport">
            <export_descriptive locale="fr_FR">
                <title>Clients</title>
                <description>Exporter toutes les informations à propos de vos clients</description>
            </export_descriptive>
            <export_descriptive locale="en_US">
                <title>Customers</title>
                <description>Export all the information about your customers</description>
            </export_descriptive>
        </export>

        <export id="thelia.export.prices" class="Thelia\Domain\DataTransfer\Export\Type\ProductPricesExport" category_id="thelia.export.products">
            <export_descriptive locale="fr_FR">
                <title>Prix des produits Hors-Taxes</title>
                <description>Exporter le prix hors taxes de vos produits</description>
            </export_descriptive>
            <export_descriptive locale="en_US">
                <title>Product prices excluding taxes</title>
                <description>Export the prices of the products excluding taxes</description>
            </export_descriptive>
        </export>

        <export id="thelia.export.taxed_prices" class="Thelia\Domain\DataTransfer\Export\Type\ProductTaxedPricesExport" category_id="thelia.export.products">
            <export_descriptive locale="fr_FR">
                <title>Prix des produits TTC</title>
                <description>Exporter le prix TTC de vos produits</description>
            </export_descriptive>
            <export_descriptive locale="en_US">
                <title>Product prices including taxes</title>
                <description>Export the prices of the products including taxes</description>
            </export_descriptive>
        </export>

        <export id="thelia.export.product_seo" class="Thelia\Domain\DataTransfer\Export\Type\ProductSEOExport" category_id="thelia.export.products">
            <export_descriptive locale="en_US">
                <title>Product SEO information</title>
                <description>
                    Export the SEO information ( rewritten url, meta description and keywords, page title ) of your products
                </description>
            </export_descriptive>
            <export_descriptive locale="fr_FR">
                <title>Informations SEO des produits</title>
                <description>
                    Exporter les informations SEO de vos produits
                    ( url réécrites, meta description et mots clés, titre ) de vos produits
                </description>
            </export_descriptive>
        </export>

        <export id="thelia.export.content" class="Thelia\Domain\DataTransfer\Export\Type\ContentExport" category_id="thelia.export.content">
            <export_descriptive locale="en_US">
                <title>Contents and folder</title>
                <description>
                    Export your contents and their related folders
                </description>
            </export_descriptive>
            <export_descriptive locale="fr_FR">
                <title>Contenus et dossiers</title>
                <description>
                    Exporter vos contenus et les dossiers associés
                </description>
            </export_descriptive>
        </export>

        <export id="thelia.export.orders" class="Thelia\Domain\DataTransfer\Export\Type\OrderExport" category_id="thelia.export.orders">
            <export_descriptive locale="en_US">
                <title>Full orders</title>
                <description>
                    Export your orders
                </description>
            </export_descriptive>
            <export_descriptive locale="fr_FR">
                <title>Commandes complètes</title>
                <description>
                    Exporter vos commandes
                </description>
            </export_descriptive>
        </export>

        <export id="thelia.export.order_lines" class="Thelia\Domain\DataTransfer\Export\Type\OrderLineExport" category_id="thelia.export.orders">
            <export_descriptive locale="en_US">
                <title>Order lines</title>
                <description>
                    One row per order line: product and combination references, GTIN and manufacturer part number as they were when the order was placed, quantity and unit price.
                </description>
            </export_descriptive>
            <export_descriptive locale="fr_FR">
                <title>Lignes de commande</title>
                <description>
                    Une ligne par article commandé : références du produit et de la déclinaison, GTIN et référence fabricant tels qu'au moment de la commande, quantité et prix unitaire.
                </description>
            </export_descriptive>
        </export>

        <export id="thelia.export.product_i18n" class="Thelia\Domain\DataTransfer\Export\Type\ProductI18nExport" category_id="thelia.export.products">
            <export_descriptive locale="en_US">
                <title>Product I18n information</title>
                <description>
                    Export the I18n information (title, chapo, description, postscriptum) of your products
                </description>
            </export_descriptive>
            <export_descriptive locale="fr_FR">
                <title>Informations I18n des produits</title>
                <description>
                    Exporter les informations I18n de vos produits (titre produit, résumé, description, conclusion)
                </description>
            </export_descriptive>
        </export>

        <export id="thelia.export.conversion_funnel" class="Thelia\Domain\DataTransfer\Export\Type\ConversionFunnelExport" category_id="thelia.export.reports">
            <export_descriptive locale="en_US">
                <title>Conversion funnel</title>
                <description>
                    Carts created, carts with a line, carts with a delivery module, carts with a payment module, orders placed and orders paid, one row per day. Without a period, from the earliest date still covered by the cart retention window until today.
                </description>
            </export_descriptive>
            <export_descriptive locale="fr_FR">
                <title>Entonnoir de conversion</title>
                <description>
                    Paniers créés, paniers avec article, paniers avec mode de livraison, paniers avec moyen de paiement, commandes passées et payées, une ligne par jour. Sans période, depuis la date la plus ancienne encore couverte par la durée de conservation des paniers jusqu'à aujourd'hui.
                </description>
            </export_descriptive>
        </export>
    </exports>
</config>
