<?xml version="1.0" encoding="UTF-8" ?>

<config xmlns="http://thelia.net/schema/dic/config"
        xmlns:xsi="http://www.w3.org/2001/XMLSchema-instance"
        xsi:schemaLocation="http://thelia.net/schema/dic/config http://thelia.net/schema/dic/config/thelia-1.0.xsd">

    <parameters>
        <parameter key="test.client.class">Thelia\Core\HttpKernel\Client</parameter>
        <parameter key="test.client.parameters" type="collection"></parameter>
        <parameter key="test.client.history.class">Symfony\Component\BrowserKit\History</parameter>
        <parameter key="test.client.cookiejar.class">Symfony\Component\BrowserKit\CookieJar</parameter>
    </parameters>

    <services>
        <service id="test.client" class="%test.client.class%" public="true">
            <argument type="service" id="kernel" />
            <argument>%test.client.parameters%</argument>
            <argument type="service" id="test.client.history" />
            <argument type="service" id="test.client.cookiejar" />
        </service>

        <service id="test.client.history" class="%test.client.history.class%" />

        <service id="test.client.cookiejar" class="%test.client.cookiejar.class%" />

    </services>

</config>
