<?xml version="1.0" encoding="UTF-8" ?>

<config xmlns="http://thelia.net/schema/dic/config"
        xmlns:xsi="http://www.w3.org/2001/XMLSchema-instance"
        xsi:schemaLocation="http://thelia.net/schema/dic/config http://thelia.net/schema/dic/config/thelia-1.0.xsd">

    <loops>
    </loops>

    <forms>
        <form name="hooksocial.configuration.form" class="HookSocial\Form\Configuration" />
    </forms>

    <commands>
    </commands>

    <hooks>
        <hook id="hooksocial.hook.front" class="HookSocial\Hook\FrontHook" scope="request">
            <tag name="hook.event_listener" event="main.footer-body" />
        </hook>
        <hook id="hooksocial.hook.back" class="HookSocial\Hook\BackHook" scope="request">
            <tag name="hook.event_listener" event="module.configuration" type="back" method="onModuleConfiguration" />
            <tag name="hook.event_listener" event="module.config-js" type="back" method="onModuleConfigurationJS" />
        </hook>
    </hooks>

</config>
