<?xml version="1.0" encoding="UTF-8" ?>

<config xmlns="http://thelia.net/schema/dic/config"
        xmlns:xsi="http://www.w3.org/2001/XMLSchema-instance"
        xsi:schemaLocation="http://thelia.net/schema/dic/config http://thelia.net/schema/dic/config/thelia-1.0.xsd">

    <commands>
        <command class="Thelia\Command\ClearImageCache"/>
        <command class="Thelia\Command\CacheClear"/>
        <command class="Thelia\Command\Install"/>
        <command class="Thelia\Command\ModuleGenerateCommand"/>
        <command class="Thelia\Command\ModuleGenerateModelCommand"/>
        <command class="Thelia\Command\ModuleGenerateSqlCommand"/>
        <command class="Thelia\Command\ModuleRefreshCommand"/>
        <command class="Thelia\Command\ModuleActivateCommand"/>
        <command class="Thelia\Command\ModuleDeactivateCommand"/>
        <command class="Thelia\Command\ModuleListCommand"/>
        <command class="Thelia\Command\ModulePositionCommand"/>
        <command class="Thelia\Command\CreateAdminUser"/>
        <command class="Thelia\Command\ReloadDatabaseCommand"/>
        <command class="Thelia\Command\GenerateResources"/>
        <command class="Thelia\Command\AdminUpdatePasswordCommand"/>
        <command class="Thelia\Command\ConfigCommand"/>
        <command class="Thelia\Command\SaleCheckActivationCommand"/>
        <command class="Thelia\Command\GenerateSQLCommand"/>
        <command class="Thelia\Command\HookCleanCommand"/>
    </commands>

</config>
